stt,tên việc,link
1,Giáo Viên Tiếng Anh Online - Thu Nhập Upto 20 Triệu,https://vn.joboko.com/viec-lam-giao-vien-tieng-anh-online-thu-nhap-upto-20-trieu-xvi6117106
2,Quản Lý Dự Án Phần Mềm Tiếng Nhật N2 - Có thể làm việc Remote,https://vn.joboko.com/viec-lam-quan-ly-du-an-yeu-cau-tieng-nhat-n2-xvi6104027
3,Giáo Viên Tiếng Anh Online - Thu Nhập Upto 20 Triệu,https://vn.joboko.com/viec-lam-giao-vien-tieng-anh-online-xvi6041713
4,Nhân Viên Chuyên Sâu Về Truyền Dẫn (Quận Tân Bình),https://vn.joboko.com/viec-lam-nhan-vien-chuyen-sau-ve-truyen-dan-quan-tan-binh-xvi6079081
5,Nhân Viên Quản Lý Tài Sản,https://vn.joboko.com/viec-lam-nhan-vien-quan-ly-tai-san-xvi6096804
6,Nhân Viên Điều Hành Viễn Thông,https://vn.joboko.com/viec-lam-nhan-vien-dieu-hanh-vien-thong-xvi6095800
7,Nhân Viên Kinh Doanh Quốc Tế,https://vn.joboko.com/viec-lam-nhan-vien-kinh-doanh-quoc-te-xvi5977454
8,Nhân Viên Kỹ Thuật Điện Tử,https://vn.joboko.com/viec-lam-nhan-vien-ky-thuat-dien-tu-xvi5893566
9,Nhân Viên Agency (Quản Lý Idol Và Vận Hành Livestream),https://vn.joboko.com/viec-lam-nhan-vien-agency-quan-ly-idol-va-van-hanh-livestream-xvi6070718
10,CTV Kinh Doanh - Loa Thanh Toán MBBank,https://vn.joboko.com/viec-lam-ctv-kinh-doanh-loa-thanh-toan-mbbank-xvi6070948
11,Nhân Viên R&D (Thực Phẩm) - Thu Nhập Up To 12Tr (Bình Phước),https://vn.joboko.com/viec-lam-nhan-vien-r-d-thuc-pham-thu-nhap-up-to-12tr-binh-phuoc-xvi6111108
12,Trưởng Phòng Công Nghệ Thông Tin,https://vn.joboko.com/viec-lam-truong-phong-cong-nghe-thong-tin-xvi6005324
13,Nhân Viên Vận Hành Máy,https://vn.joboko.com/viec-lam-nhan-vien-van-hanh-may-xvi6110834
14,Nhân Viên R&D (Thực Phẩm) - Làm Việc Tại Đồng Nai (Bình Phước Cũ),https://vn.joboko.com/viec-lam-nhan-vien-r-d-thuc-pham-lam-viec-tai-dong-nai-binh-phuoc-cu-xvi6064954
15,Nhân Viên Bán Hàng Điện Máy PC PS Promoter,https://vn.joboko.com/viec-lam-nhan-vien-ban-hang-dien-may-pc-ps-promoter-xvi6095946
16,Nhân Viên Bảo Trì Điện,https://vn.joboko.com/viec-lam-nhan-vien-bao-tri-dien-xvi6100965
17,Nhân Viên Kỹ Thuật Sctv,https://vn.joboko.com/viec-lam-nhan-vien-ky-thuat-sctv-xvi6060948
18,Nhân Viên Kỹ Thuật Cơ Khí,https://vn.joboko.com/viec-lam-nhan-vien-ky-thuat-co-khi-xvi6075752
19,Software QA Engineer (Remote),https://vn.joboko.com/viec-lam-software-qa-engineer-remote-xvi6102428
20,"Nhân Viên Kỹ Thuật - Bình Dương , Lâm Đồng",https://vn.joboko.com/viec-lam-nhan-vien-ky-thuat-binh-duong-lam-dong-xvi6087044
21,Chuyên Viên Công Nghệ Thông Tin (IT),https://vn.joboko.com/viec-lam-chuyen-vien-cong-nghe-thong-tin-it-xvi6105404
22,Nhân viên Kỹ Thuật Phần Mềm,https://vn.joboko.com/viec-lam-cellphones-nhan-vien-ky-thuat-phan-mem-xvi4487263
23,"NV Hệ thống Thông tin IT - Đồng Phú, Bình Phước",https://vn.joboko.com/viec-lam-nv-he-thong-thong-tin-it-dong-phu-binh-phuoc-xvi6017546
24,NHÂN VIÊN IT,https://vn.joboko.com/viec-lam-nhan-vien-it-xvi5723705
