stt,tên việc,link
1,Giáo Viên Tiếng Anh Online - Thu Nhập Upto 20 Triệu,https://vn.joboko.com/viec-lam-giao-vien-tieng-anh-online-thu-nhap-upto-20-trieu-xvi6117106
2,Quản Lý Dự Án Phần Mềm Tiếng Nhật N2 - Có thể làm việc Remote,https://vn.joboko.com/viec-lam-quan-ly-du-an-yeu-cau-tieng-nhat-n2-xvi6104027
3,Giáo Viên Tiếng Anh Online - Thu Nhập Upto 20 Triệu,https://vn.joboko.com/viec-lam-giao-vien-tieng-anh-online-xvi6041713
4,Tuyển PHP Developer Làm việc tại nhà,https://vn.joboko.com/viec-lam-tuyen-php-developer-lam-viec-tai-nha-xvi6116288
5,Làm việc tại nhà Kỹ sư Phần mềm JAVA/Android,https://vn.joboko.com/viec-lam-lam-viec-tai-nha-ky-su-phan-mem-java-android-xvi6066281
6,Nhân Viên Agency (Quản Lý Idol Và Vận Hành Livestream),https://vn.joboko.com/viec-lam-nhan-vien-agency-quan-ly-idol-va-van-hanh-livestream-xvi6070718
7,Nhân Viên Lập Trình Và Vận Hành Phay CNC - Làm Việc Tại Công Ty Mẹ Nhật Bản,https://vn.joboko.com/viec-lam-nhan-vien-lap-trinh-va-van-hanh-phay-cnc-lam-viec-tai-cong-ty-me-nhat-ban-xvi6077820
8,"[Online] Công Ty Enfinfy Holding LLC Tuyển Dụng Nhân Viên Full-Time: Content Researcher & UX/UI Designer 2025 (Không Yêu Cầu Kinh Nghiệm, Mức Lương 12-15 Triệu/Tháng)",https://vn.joboko.com/viec-lam-online-cong-ty-enfinfy-holding-llc-tuyen-dung-nhan-vien-full-time-content-researcher-ux-ui-designer-2025-khong-yeu-cau-kinh-nghiem-muc-luong-12-15-trieu-thang-xvi6116786
9,Junior Business Analyst In Our SAN ISIDRO Office,https://vn.joboko.com/viec-lam-junior-business-analyst-in-our-san-isidro-office-xvi6059440
10,[Online] Công Ty Get Biz Tuyển Dụng Nhân Viên Academic Writter Part-time/Full-time 2025,https://vn.joboko.com/viec-lam-online-cong-ty-get-biz-tuyen-dung-nhan-vien-academic-writter-part-time-full-time-2025-xvi6089620
11,[Online] Công Ty Dịch Vụ Biển Bạc Tuyển Dụng Nhân Viên Product Owner For API/RPA/CRM Automation Full-time 2025,https://vn.joboko.com/viec-lam-online-cong-ty-dich-vu-bien-bac-tuyen-dung-nhan-vien-product-owner-for-api-rpa-crm-automation-full-time-2025-xvi6030000
12,Lập Trình Viên Từ N3,https://vn.joboko.com/viec-lam-lap-trinh-vien-tu-n3-visa-nhanh-xvi5842806
13,"Junior Business Analyst At Bitel, Based In Peru",https://vn.joboko.com/viec-lam-junior-business-analyst-at-bitel-based-in-peru-xvi6061654
14,[Online] Công Ty KNOWME Tuyển Dụng Virtual Assistant Full-Time 2025,https://vn.joboko.com/viec-lam-online-cong-ty-knowme-tuyen-dung-virtual-assistant-full-time-2025-xvi6101965
