stt,tên việc,link
1,Giáo Viên Tiếng Anh Online - Thu Nhập Upto 20 Triệu,https://vn.joboko.com/viec-lam-giao-vien-tieng-anh-online-thu-nhap-upto-20-trieu-xvi6117106
2,Quản Lý Dự Án Phần Mềm Tiếng Nhật N2 - Có thể làm việc Remote,https://vn.joboko.com/viec-lam-quan-ly-du-an-yeu-cau-tieng-nhat-n2-xvi6104027
3,Giáo Viên Tiếng Anh Online - Thu Nhập Upto 20 Triệu,https://vn.joboko.com/viec-lam-giao-vien-tieng-anh-online-xvi6041713
4,"THỢ NỮ TRANG - QUY NHƠN, BÌNH ĐỊNH",https://vn.joboko.com/viec-lam-tho-nu-trang-quy-nhon-binh-dinh-xvi5076208
5,"Cửa Hàng Trưởng (PNJ 311 Quang Trung, TT Phú Phong, Tây Sơn, Bình Định)",https://vn.joboko.com/viec-lam-cua-hang-truong-pnj-311-quang-trung-tt-phu-phong-tay-son-binh-dinh-xvi6008001
6,Nhân Viên Kỹ Thuật Viễn Thông,https://vn.joboko.com/viec-lam-nhan-vien-ky-thuat-vien-thong-xvi6079843
7,Giảng Viên Công Nghệ Thông Tin,https://vn.joboko.com/viec-lam-giang-vien-cong-nghe-thong-tin-xvi6046494
8,Nhân viên kỹ thuật bảo hành tại Hoài Đức - Hà Nội,https://vn.joboko.com/viec-lam-nhan-vien-ky-thuat-bao-hanh-tai-hoai-duc-ha-noi-xvi6066959
9,Chuyên Viên Quản Lý Lương Và Vận Hành Giáo Viên,https://vn.joboko.com/viec-lam-chuyen-vien-quan-ly-luong-va-van-hanh-giao-vien-xvi6070672
10,Business Development Manager,https://vn.joboko.com/viec-lam-business-development-manager-xvi6020980
11,Cộng Tác Viên Kinh Doanh Phần Mềm & AI,https://vn.joboko.com/viec-lam-cong-tac-vien-kinh-doanh-phan-mem-ai-xvi6058669
12,Nhân Viên Cơ Khí,https://vn.joboko.com/viec-lam-nhan-vien-co-khi-xvi6060625
13,Kỹ Sư Cơ Điện M&E - Lương Upto 20tr - Tại Hà Nội Và Bình Định,https://vn.joboko.com/viec-lam-ky-su-co-dien-m-e-luong-upto-20tr-tai-ha-noi-va-binh-dinh-xvi6029912
14,Nhân Viên Agency (Quản Lý Idol Và Vận Hành Livestream),https://vn.joboko.com/viec-lam-nhan-vien-agency-quan-ly-idol-va-van-hanh-livestream-xvi6070718
15,Nhân Viên Tư Vấn Thiết Kế Kiến Trúc - Nội Thất,https://vn.joboko.com/viec-lam-nhan-vien-tu-van-thiet-ke-kien-truc-noi-that-xvi6106910
16,Sport Scout,https://vn.joboko.com/viec-lam-sport-scout-xvi5977119
17,"CTV Bán Hàng Dịch Vụ , Phần Mềm",https://vn.joboko.com/viec-lam-ctv-ban-hang-dich-vu-phan-mem-xvi6103232
18,CTV Kinh Doanh - Loa Thanh Toán MBBank,https://vn.joboko.com/viec-lam-ctv-kinh-doanh-loa-thanh-toan-mbbank-xvi6070948
19,Nhân Viên Cơ Điện,https://vn.joboko.com/viec-lam-nhan-vien-co-dien-xvi6070891
20,NHÂN VIÊN IT,https://vn.joboko.com/viec-lam-nhan-vien-it-xvi6071646
21,Senior Personal Development Coach (Huấn luyện viên phát triển cá nhân),https://vn.joboko.com/viec-lam-senior-personal-development-coach-huan-luyen-vien-phat-trien-ca-nhan-xvi6039352
22,Nhân Viên Kỹ Thuật Viễn Thông,https://vn.joboko.com/viec-lam-nhan-vien-ky-thuat-vien-thong-xvi6083885
23,Chuyên Viên Media - Designer,https://vn.joboko.com/viec-lam-chuyen-vien-media-designer-xvi6080052
24,HR Development,https://vn.joboko.com/viec-lam-hr-development-xvi5865781
25,Nhân Viên Tư Vấn Bán Hàng Tại Quy Nhơn - Bình Đinh,https://vn.joboko.com/viec-lam-nhan-vien-tu-van-ban-hang-tai-quy-nhon-binh-dinh-xvi6080777
26,Sales Thiết Bị Điện/Nhân Viên Kinh Doanh,https://vn.joboko.com/viec-lam-sales-thiet-bi-dien-nhan-vien-kinh-doanh-xvi6055813
27,Kỹ Thuật Bảo Trì/ Sửa Chữa,https://vn.joboko.com/viec-lam-ky-thuat-bao-tri-sua-chua-nhan-sv-moi-ra-truong-xvi5879295
28,Nhân Viên Bán Hàng Điện Máy PC PS Promoter,https://vn.joboko.com/viec-lam-nhan-vien-ban-hang-dien-may-pc-ps-promoter-xvi6095946
29,"Platform ,middleware Technical Lead Android",https://vn.joboko.com/viec-lam-platform-middleware-technical-lead-android-xvi6099682
30,Software QA Engineer (Remote),https://vn.joboko.com/viec-lam-software-qa-engineer-remote-xvi6102428
31,Trợ Lý Kinh Doanh /Sales Admin,https://vn.joboko.com/viec-lam-tro-ly-kinh-doanh-sales-admin-xvi6091411
32,Trưởng Nhóm Kinh Doanh (Sales) (Sales Manager - Exporting Furniture (Binh Dinh)) - Đi Làm Ngay,https://vn.joboko.com/viec-lam-truong-nhom-kinh-doanh-sales-sales-manager-exporting-furniture-binh-dinh-di-lam-ngay-xvi6080102
33,Giám Đốc Kỹ Thuật,https://vn.joboko.com/viec-lam-giam-doc-ky-thuat-xvi6079852
34,CTV Kinh Doanh Giải Pháp Công Nghệ,https://vn.joboko.com/viec-lam-ctv-kinh-doanh-giai-phap-cong-nghe-xvi6072058
35,DEVELOPER,https://vn.joboko.com/viec-lam-developer-xvi6012154
36,"Nhân Viên Lập Trình Frotend React, Nextjs Tại Quy Nhơn",https://vn.joboko.com/viec-lam-nhan-vien-lap-trinh-frotend-react-nextjs-tai-quy-nhon-xvi6115370
37,ERP Engineer,https://vn.joboko.com/viec-lam-erp-engineer-xvi6048730
38,"Kỹ Thuật Sửa Chữa Và Bảo Dưỡng Âm Thanh, Máy Tính",https://vn.joboko.com/viec-lam-ky-thuat-sua-chua-va-bao-duong-am-thanh-may-tinh-xvi6097064
39,Nhân viên Kỹ Thuật Phần Mềm,https://vn.joboko.com/viec-lam-cellphones-nhan-vien-ky-thuat-phan-mem-xvi4487263
40,AI Engineer,https://vn.joboko.com/viec-lam-ai-engineer-xvi5917658
41,Thiết Kế Đồ Họa,https://vn.joboko.com/viec-lam-thiet-ke-do-hoa-xvi6093894
