stt,tên việc,link
1,Giáo Viên Tiếng Anh Online - Thu Nhập Upto 20 Triệu,https://vn.joboko.com/viec-lam-giao-vien-tieng-anh-online-thu-nhap-upto-20-trieu-xvi6117106
2,Quản Lý Dự Án Phần Mềm Tiếng Nhật N2 - Có thể làm việc Remote,https://vn.joboko.com/viec-lam-quan-ly-du-an-yeu-cau-tieng-nhat-n2-xvi6104027
3,Giáo Viên Tiếng Anh Online - Thu Nhập Upto 20 Triệu,https://vn.joboko.com/viec-lam-giao-vien-tieng-anh-online-xvi6041713
4,Kỹ Sư Cơ Điện,https://vn.joboko.com/viec-lam-ky-su-co-dien-xvi6087104
5,HRIS Executive,https://vn.joboko.com/viec-lam-hris-executive-xvi3907862
6,Senior Software Quality Control Executive,https://vn.joboko.com/viec-lam-senior-software-quality-control-executive-xvi4957470
7,Chuyên viên Cấp cao Phân tích Dữ liệu,https://vn.joboko.com/viec-lam-chuyen-vien-cap-cao-phan-tich-du-lieu-xvi5086600
8,Senior Back End Development Executive,https://vn.joboko.com/viec-lam-senior-back-end-development-executive-xvi5023706
9,Nhân Viên Vận Hành Hệ Thống Khử Màu - Làm Việc Tại Tân Phú - Tây Ninh,https://vn.joboko.com/viec-lam-nhan-vien-van-hanh-he-thong-khu-mau-lam-viec-tai-tan-phu-tay-ninh-xvi6065935
10,Nhân Viên Kỹ Thuật Hạ Tầng Mạng - Viễn Thông,https://vn.joboko.com/viec-lam-nhan-vien-ky-thuat-ha-tang-mang-vien-thong-xvi6100212
11,Nhân viên IT - Phát triển phần mềm (Software Developer),https://vn.joboko.com/viec-lam-nhan-vien-it-phat-trien-phan-mem-software-developer-xvi6052665
12,Nhân Viên Agency (Quản Lý Idol Và Vận Hành Livestream),https://vn.joboko.com/viec-lam-nhan-vien-agency-quan-ly-idol-va-van-hanh-livestream-xvi6070718
13,Nhân Viên Kinh Doanh Điện Năng Lượng Mặt Trời,https://vn.joboko.com/viec-lam-nhan-vien-kinh-doanh-dien-nang-luong-mat-troi-xvi6104240
14,Kỹ Sư Công Trình (Chuyên Ngành Điện & IT - Network),https://vn.joboko.com/viec-lam-ky-su-cong-trinh-chuyen-nganh-dien-it-network-xvi6093400
15,Chuyên viên IT,https://vn.joboko.com/viec-lam-chuyen-vien-it-xvi6062632
16,Resources and Administration Director,https://vn.joboko.com/viec-lam-resources-and-administration-director-xvi6098622
17,Nhân Viên Kinh Doanh Dự Án Viễn Thông CNTT,https://vn.joboko.com/viec-lam-nhan-vien-kinh-doanh-du-an-vien-thong-cntt-xvi6089997
18,Nhân Viên Cntt - Tây Ninh,https://vn.joboko.com/viec-lam-nhan-vien-cntt-tay-ninh-xvi6104954
19,Nhân Viên Kỹ Thuật,https://vn.joboko.com/viec-lam-nhan-vien-ky-thuat-xvi6018235
20,Chuyên Viên Vận Hành Các Nền Tảng Mạng Xã Hội,https://vn.joboko.com/viec-lam-chuyen-vien-van-hanh-cac-nen-tang-mang-xa-hoi-xvi6059497
21,IT INFRASTRUCTURE EXECUTIVE,https://vn.joboko.com/viec-lam-it-infrastructure-executive-xvi1741014
22,International Sales Executive,https://vn.joboko.com/viec-lam-international-sales-executive-xvi6008243
23,[TÂY NINH] KỸ THUẬT VIÊN SỬA CHỮA ĐIỆN THOẠI,https://vn.joboko.com/viec-lam-tay-ninh-ky-thuat-vien-sua-chua-dien-thoai-xvi5941875
24,Nhân Viên Cơ Điện,https://vn.joboko.com/viec-lam-nhan-vien-co-dien-xvi6059283
